{
  "id": "fsa-briefing",
  "name": "FSA Case Briefing Memo",
  "nameKm": "កំណត់បង្ហាញរឿង",
  "category": "memo",
  "page": {
    "size": "A4",
    "orientation": "portrait",
    "margins": {
      "top": 2.54,
      "bottom": 2.54,
      "left": 3.17,
      "right": 2.54
    }
  },
  "fonts": {
    "title": { "family": "Khmer OS Siemreap", "size": 14, "bold": true },
    "body": { "family": "Khmer OS Siemreap", "size": 11, "lineSpacing": 1.5 },
    "header": { "family": "Khmer OS Muollight", "size": 11 },
    "footer": { "family": "Khmer OS Siemreap", "size": 9 }
  },
  "letterhead": {
    "enabled": true,
    "logoPosition": "center",
    "ministryName": true,
    "departmentName": true,
    "emblem": true
  },
  "footer": {
    "enabled": true,
    "pageNumber": true,
    "address": false
  },
  "sections": [
    { "id": "header_kingdom", "label": "Kingdom Header", "labelKm": "ក្បាលរាជាណាចក្រ", "type": "text", "required": true, "order": 1 },
    { "id": "memo_number", "label": "Memo Number", "labelKm": "លេខកំណត់", "type": "text", "required": true, "order": 2 },
    { "id": "date", "label": "Date", "labelKm": "កាលបរិច្ឆេទ", "type": "date", "required": true, "order": 3 },
    { "id": "to", "label": "To", "labelKm": "ជូន", "type": "text", "required": true, "order": 4 },
    { "id": "from", "label": "From", "labelKm": "ពី", "type": "text", "required": true, "order": 5 },
    { "id": "subject", "label": "Subject", "labelKm": "កម្មវត្ថុ", "type": "text", "required": true, "order": 6 },
    { "id": "background", "label": "Background", "labelKm": "ប្រវត្តិរឿង", "type": "richtext", "required": true, "order": 7 },
    { "id": "findings", "label": "Findings", "labelKm": "ការរកឃើញ", "type": "richtext", "required": true, "order": 8 },
    { "id": "recommendation", "label": "Recommendation", "labelKm": "អនុសាសន៍", "type": "richtext", "required": true, "order": 9 },
    { "id": "signature", "label": "Signature", "labelKm": "ហត្ថលេខា", "type": "signature", "required": true, "order": 10 }
  ],
  "placeholders": {
    "{{MEMO_NUMBER}}": "Memo reference number",
    "{{TO}}": "Recipient name and title",
    "{{FROM}}": "Sender name and title",
    "{{SUBJECT}}": "Memo subject",
    "{{BACKGROUND}}": "Background of the case",
    "{{FINDINGS}}": "Findings of the investigation",
    "{{RECOMMENDATION}}": "Recommended action",
    "{{SIGNER_NAME}}": "Signer name",
    "{{SIGNER_TITLE}}": "Signer title"
  }
}
