{
  "id": "audit-report",
  "name": "Audit Report",
  "nameKm": "TODO: Add Khmer name",
  "category": "other",
  "page": {
    "size": "A4",
    "orientation": "portrait",
    "margins": {
      "top": 2.54,
      "bottom": 2.54,
      "left": 3.17,
      "right": 2.54
    }
  },
  "fonts": {
    "title": {
      "family": "Khmer OS Siemreap",
      "size": 14,
      "bold": true
    },
    "body": {
      "family": "Khmer OS Siemreap",
      "size": 11,
      "lineSpacing": 1.5
    },
    "header": {
      "family": "Khmer OS Muollight",
      "size": 11
    },
    "footer": {
      "family": "Khmer OS Siemreap",
      "size": 9
    }
  },
  "letterhead": {
    "enabled": true,
    "logoPosition": "center",
    "ministryName": true,
    "departmentName": true,
    "emblem": true
  },
  "footer": {
    "enabled": true,
    "pageNumber": true,
    "address": false
  },
  "sections": [
    {
      "id": "header_kingdom",
      "label": "Kingdom Header",
      "labelKm": "ក្បាលរាជាណាចក្រ",
      "type": "text",
      "required": true,
      "order": 1
    },
    {
      "id": "date",
      "label": "Date",
      "labelKm": "កាលបរិច្ឆេទ",
      "type": "date",
      "required": true,
      "order": 2
    },
    {
      "id": "body",
      "label": "Body",
      "labelKm": "ខ្លឹមសារ",
      "type": "richtext",
      "required": true,
      "order": 3
    },
    {
      "id": "signature",
      "label": "Signature",
      "labelKm": "ហត្ថលេខា",
      "type": "signature",
      "required": true,
      "order": 4
    }
  ],
  "placeholders": {
    "{{DATE}}": "Date",
    "{{BODY}}": "Main content",
    "{{SIGNER_NAME}}": "Signer name",
    "{{SIGNER_TITLE}}": "Signer title"
  }
}
